reviews,ratings,date
"*My wife and I consider this as our favorite value for money hotel in Boracay.  This hotel was built to cater to middle class/low income bracket Filipinos who want to have the Boracay experience.   Naturally it tries to meet the needs of its target client while maintaining its affordability. Price starts from around P2,000... For this price you get a good clean room with comfy bed/s, air conditioning, flat screen with cable TV, pressure shower (hot/cold), housekeeping (by request), safe box.  Breakfast is also included but you have the option of paying extra P50 to convert it to a buffet. This hotel is beach front (border of Station 1 and 3) with a nice swimming pool and a restaurant that serves decent and affordable foods.   CONS:   1. It is crowded.  But once in your room (in…",4,January 2013
This place has greatly Improved Since I last cam here Which was back in 2010. The property has expanded left and right. A very strategic spot with lots of night activities. A good mix of different breeds.,4,July 2013
"The location is right in the middle of everything, very convenient for getting around.  The free wifi is only available in the lobby, paid wifi for 100 PHP per hour in the rooms. The lobby is ok if you can work with screaming kids and chinese tourists yelling at each other. Wifi connection is a bit slow and unreliable.  We were placed in the new wing across the street from the main building, brand new, very clean and attractive. The rooms are very comfortable, the view unfortunately is of a ugly green screen put up around the construction site a couple of meters away.  Staff are very friendly and helpful, the usual jet ski/parasail touts that hang around in the entrance to the hotel are of course annoying and a bit too persistent, it would be nice if hotel management could do…",3,September 2013
"Our room was ok, with clean sheets and pillows. Buffet breakfast was ok but there are limited seats available so you have to eat early. Location wise, La Carmela is ok since it is located beachfront, at the middle of Station 2. You can get around easily from and to Station 3 to 1.",4,May 2013
"We booked through one of the major Philippine Travel Agencies, and got what we thought was a good deal for 3 nights with 5 adults for July 9, 10 and 11, 2013.  Unfortunately, when we arrived at La Carmela, things happened.  We arrived around 10:00 AM and were told our room would not be ready until at least 2:00-3:00 PM, okay we understood.  We waited and checked on the status at 12:00, still not ready and at 1:30, the room was ready, but no one was going to let us know that the room was ready.  Next, we were shown to a very small room, with sleeping for only 3, note we were 5 adults.  So, it was back to the main desk and try to work this out.  We finally got room, #304, which only had 2 double beds (sleeping for 4), finally after we talked to housekeeping (ourselves), a cot was…",2,July 2013
"Our stay in La Carmela was nice and comfortable, best value for our money and the location of the hotel is good. I like it that they put  water dispensers in every floor.  Hotel staff were friendly and let us checked in at 12pm instead of 2pm. The buffet breakfast was okay but its just worth the price. Our room was clean.   Thank you Travelonline for making our family vacation possible. Best value for our money, nice service and helpful travel agents. Thanks to Ma. Clarissa Salazar for your assistance. More power and  God Bless! If you want to check out their package visit travelonline.ph.",5,September 2013
"We stayed during the Christmas Season and the sun was shinning like a diamond. The weather was on our side and our beachfront resort was a great spot for sunbathing, taking a deep either in the resort's pool or in the beach.   It is located in the central part of the island which is at Phase 2. A few walks away from restaurants,boutiques and bars.   I'm pleased with their breakfast buffet and I can't get enough of the crispy bacon and chilled fruits. A great way to start the day with a big smile and a happy stomach.   Check my boracay stories here: http://vacationchecklist.blogspot.sg/search/label/Boracay?m=0",5,December 2012
"room were dirty esp., bathroom is dirty worst they refill the complimentary shampoo and conditioner. breakfast was so bad and cold. patio door not working very poor maintenance.only thing good is closed to the beach. never again will come back to this hotel..",2,August 2013
"I stayed here twice and I can say there's a lot of improvements in terms of physical look of the hotel and the service. i love the breakfast, different everyday. Location is good. I recommended it to my friends and family.",4,October 2012
"The Hotel itself is not one I would stay to again. My in-laws booked it and paid for it and so we had no choice. The room is small and musty. Breakfast was included with the hotel stay but the food itself was bland. Nothing to rave about. And it was the same food every day. The only thing I love about this place was the beach was there as you step out. Other than that, I wouldn't stay in this hotel again.",1,September 2013
"My wife and I booked La Carmela through agoda.com for 12 nights in August. We had done some research and thought the location was great, and would allow us to do lots of relaxing by the pool, while still having easy access to the beach and activities. In that way it was a fairly good choice. Unfortunately in other ways the hotel was a bit of a disappointment. The photos on agoda.com gave the impression that the rooms were more modern than they actually were. Our room (308) was not only fairly old, but needed repeated attention for the broken safe and hot water heater. The hot water heater had to be replaced while we were there (about 1 hour sitting in room) and the safe had to have the batteries changed in it about 5 times before it would work properly. The power went out a…",2,August 2013
"Only worth it if it is a super last minute booking (no other place available in all the island) and during low season. We stayed there during chinese new year, super expensive and no service at all. Ants on the pillow and on your face every morning, noisy room and dirty. Uneatable breakfast, even if included we have to go somewhere else. Only positive thing is the location, but 99% of the hotels in Boracay are at the beach front so nothing really else to say.",1,February 2013
"RESERVATION: We booked direct to the hotel website and Reservation Staff named BRENDON is so polite and prompt in responding to our queries and very attentive to details (very important for me since it was my first trip to Boracay and i do not want to get in trouble along this important travel.) At first tried to book to an agent but to my dismay, they are so careless with your details that leads me to contact the hotel direct and i got the best rates with the grandest service! ARRIVAL/DEPARTURE: The staff is punctually waiting for us at the arrival area as round-trip airport transfers were included by the hotel and no hassles were met, we were comfortably seated to the hotel van just four of us, no other guests. Reached the hotel smoothly and safely as the hotel staff and…",5,May 2013
"The hotel itself isn't very overwhelming, booked a ocean view room but found it to be small and the mattress very uncomfortable.  Had the free breakfast included with the room but the breakfast was below average.  The air con was so noisy I found it hard to sleep.  But even with the shortcoming of this resort I was there to enjoy Boracay which on my second trip to the Philippines ever enjoyed it very much.  If I ever go back to Boracay La Carmela isn't the place where I'll be staying.",3,August 2013
This place is old & not well maintained. You could hear the noise in the hallway as if your door were open. Aircon unit could not cool the room properly. Only upside is that staff are courteous. Will have to check out immediately the following day to avoid total disaster. ,1,August 2013
"Even if i read so many bad reviews about this hotel i still booked 4D3N for 5adults and 1child in this hotel. For the reason it was the cheapest I could find booking thru the internet. How bad could it be right?! When we arrived an attendant helped us with our bags and directed us for checked in, it went out smoothly; doing the checking.... (reservations and payments of deposit 2k) we are brought to our room. We got a spacious room with 3 bed, restroom, towels, 1small bottled shampoo, mini veranda, tv, aircon, mini fridge, cabinet with hangers and volt. They don't have complimentary bottled water in the room but they have water dispensers in the lobby which you can refill water from (that's good at least right?!). My husband and I had the buffet breakfast for P230 ea. I find the…",3,August 2013
"Not as I expected it should be...the location was great but the hotel itself was poor in quality...breakfast needed to be upgraded to be able to have a buffet, otherwise will be given in set... not recommendable",3,July 2013
"Imagine that I had to request three times (8am, 2pm, and 6pm) the housekeeping to clean the room. Their own staffs seemed not familiar with their own policy as they should have reminded me to sign that MUR as prerequisite before cleaning the room. The first time I called, the staff said, 'ppnta n po'. The second staff on my second call (I am already disappointed this time) asked if its okay to clean the room without my presence and I said, go ahead. I left to do some water activities hoping that when I get back everything would be in order but that didnt happen. The third time I called the housekeeping, the staff said they lined up my request but the front desk didnt respond to their call to confirm my presence daw. I was really pissed off this time so I called the front desk to…",1,August 2013
last mother's day - took my mom (with my daughter and husband) to Boracay. Although it was raining (storm in fact) we had a good stay. Booked a Loft at the new wing of La Carmela - very clean and spacious. Resto was open all night and pool(s) were clean. Over-all - very good. Value for money also : ),4,May 2013
"Good Price for being a Beach Hotel Good Littel Pool in front of Restaurant and Hotel Quiet rooom at the back side Room ok, but not new. Restaurant is good, with fair price Charge for paying with Creditcard 6-7% So be sure u have Cash Atms can be offline/out of cash weather always overcast when we are there on Boracay hmmm",3,February 2013
"Although we did not actually stay here, I would just like to share my views about the resort's delicious lunch buffet. After island hopping, me and my friends are already tired and hungry. we were planning to go as far as station 1 to search for good food. then we saw and stumbled upon La Carmela's lunch menu for the day. not bad for P285.00 per person so we got ourselves seated and eating. Asian and Italian dishes were served that day. the meals were light and beautifully presented. the desserts are not so bad too. my favorite is the tuna mango salad, the lettuce is crunchy and the mango salsa sauce is perfect. oh, and the buffet comes with unlimited iced tea also.",4,July 2013
"We have been to Bora a bunch but usually stay at our local favorite secret just a few doors down. This time, due to a mix up and fully booked statuses, we bought one of those voucher deals online. We ended up with 3 adults (could have had 4 for no extra charge) and an infant with 2 breakfasts included (they were not good at all though, but we didn't expect them to be) for around $48 dollars per night including tax which is a deal, especially being right on the beach. They have a nice pool that kids can swim in. The room, specifically the sink needs a lot of work and they still have an old t.v. but we were not there to hang out in the room except to shower, change, or sleep. The room has a mini refrigerator and a safe which come in handy. Great location for island hopping,…",3,July 2013
"Just looks on pictures in their website it looks okay not a five star hotel but it's fine for 3d2n stay, but when we got there... terrible! what we have is an ""executive"" room sounds nice huh? all we got is a four cornered dark room with a view of the next building wall. Too far from the pictures in their ad... Breakfast? forget about it! even the buffet if you upgrade, nuh! The overall cost is cheap but still you will feel that you have been robbed at the end of the day.  The only and probably the best thing they can boost about this hotel are their STAFF! excellent for them 5 star experience; if not for them I would classify this hotel as a prison cell",2,June 2013
"I stayed the hotel with family and friends. We had booked three rooms. The first two rooms were okay but the other has poor a/c and it often smells of smoke. The location was a very big plus. It's right in front of the beach and near enough to walk to restaurants and souvenir shops. Two things I didn't like about the hotel: First, the lack of signal for our cellphones and wifi. It seems like it's being blocked whenever we enter our rooms. Free wifi has a so-so connection at the restaurant and you have to pay to have a wifi inside your room. And lastly, the pool seems dirty and poorly maintained. I did not dare swim in it. If you intend on staying here and on a budget its ok as that's what you're paying for but I bet there are better hotels along white beach.",3,July 2013
"Our 3D-3N stay at la carmela de boracay was superb! The staff were very welcoming-- the group of ""Bogs Bunny"" Roxanne and the security guards. The front desk officer attended to all our needs and requests properly. Apparently our standard room came with no hair dryer nor hot water dispenser but since we requested, we were able to get them. We were able to request for drinking water as well... We enjoyed fast free wi-fi at the restaurant and even free coffee :) I was so happy to recharge my laptop/ iphone from power outlets peeping from behind our tables. Our breakfast was okay. Toasts, meat, eggs, juice coffee... rooms are also okay..but the treatment of the staff when we were there made me give this 3-star resort hotel 10/10 rating!!! Will definitely stay there next time :)",5,July 2013
"Due to the many negative feedbacks I read about this hotel, I still booked one night 'cause I was thinking 'how bad can it be?'... According to their website: it's beach front, two pools, & free breakfast.  Well, from the beach, it looks like an ok hotel....But the pool by the beach is murky. The pool at the back is the size of a jacuzzi, not a pool, almost can be mistaken dor a fountain. The room I got was at the ""executive wing."" Which confused me 'cause it was a tiny dark room with a view of a roof. wi-fi did not work at that building. There was a free breakfast, but almost everybody paid the fee to upgrade for buffet. Check-in took about 20 minutes, they ask for a deposit (2000P). Check-out took longer 'cause they wouldn't return my deposit until they're sure that I didn't…",3,June 2013
"I was looking forward to an improved La Carmela, but.... to my surprise, it was a disappointing  stay.   When I first stayed at La Carmela, it was a promising hotel-resort that time, but after 2 years, the hotel has vast expansion, but the quality of service has dropped considerably. The quality of food too. Breakfast is a big disappointment, the quality of rice is very poor and the way the food was cooked is comparable to a carinderia.  We were given the room on the main building and the room needs a lot of improvement. The room itself is not freshly-scented.   In terms of service, the staff are not so friendly. Process of checking in is very slow, much more in checking out.  I really hope this things will improve in the future. Sayang ang ganda ng location nila if they will…",2,July 2013
"We stayed here last week july 15 and it was very disappointing. Similar to the previous post, washrooms are filled with ANTS, crawling all over the face towels they provide(gross) called houskeeping and they sent someone to spray the washroom but ants would still come back. Towels are dirty and yellow. I called 3 times in one day for housekeeping to clean our room and front desk would say ""proceeding"" as in someone is on their way.... Waited & noone came to clean our room... The worst part of it all.... As soon as i entered the room i guess they had forgotten to change the bed sheets because there wad blood all over my bed! Never again. Worst service ever. Stay away. There are far better resorts to choose from at a reasonable price",1,July 2013
"I am just wondering as all people gives complains for this hotel. I know that is not anything special however at least we have it for great prices.  It was almost for free also with flight from Manila and all transfers. I had experience that staff was polite and friendly. Specially barman's and bartenders. I appreciated there service and there were satisfied with my tips. I just turn my head to bar from the beach and I had my new cocktail within few second with me. Room was fine, room service was excellent. We order a lot of meals to the room and always it was without any problems.  I cant complain specially when I know that all those people work there almost for cup of soup and some tips.",4,October 2012
"the hotel needs a lot of improvement, the check in process was slow and the way they checked in is so ancient and they do it manually by hand, secondly they ask for a CASH deposit of 2,000 pesos to hold until after you checked out, NEVER HEARD SUCH THING BEFORE. some workers are friendly and worked a lot keeping the place clean because the area is full of people coing in and out of the beach. The breakfast that came with the room is a JOKE. It came with a single piece of chicken and a LOAD of rice, the egg was CRAPPY and uncooked. the breakfast buffet was ok but with a prize of course. the room was terrible, FIRST there ware ANTS in the bathroom when we got to our room, the bathtub is CLOGGED and we ended up being changed into another room after I complained and made a scene in…",3,June 2013
"Me and my family stayed at this hotel last summer vacation. We stayed in their family room at the what they called ""Atic"". Room was spacious that it could accommodate up to  8 persons, my parents loved the room as well. The location was nice because it was accessible to nearby shops and restaurants. Our stay was good but it will be more appreciated if there staff will learn to greet and accommodate guests well (just like other resorts). For me, having a good customer service can be one of the best asset that a hotel can have. The pool was small and needs maintenance, the food was average.",3,April 2013
"The only good thing about this resort is that you're close to the beach. We booked one of the ""oceanview"" rooms which of course cost more than the regular rooms. Our view was not of the ocean but of the swimming pool! The way the hotel faces, it's not even possible to have an oceanview room.  I think this is very misleading and should be corrected on their website. It was a good thing we weren't in our room much because it was always so rowdy at the pool and at night (I think just on the weekend) they do a fire dance show. Needless to say it was very loud and not an ideal room for those looking to just relax. The room itself was ok. The air turns off when you take the key out so it was always hot when we came back to go to bed at night and it took forever to cool the room off. I…",2,June 2013
"The a+++ is the resorts location.. The rest..... Im sorry... Very small pool, crowded, the food is not good much better if we just eat our breakfast at mcdonalds. The executive wings comfort rooms and the pool needs renovation. But if youre looking for a cheap hotel but a nice location, la carmela.",3,June 2013
"Stayed here for 2 nights and all i can say is that their only plus is their location, the rest is not even ok. The pillows and towels need to be replaced. The toilet is bad. Hot Shower not working, water supply is bad also. food is not good. A lot of marketing but poor quality. i enjoyed my first stay here year 2006. But now its so crowded. Cant relax anymore. ",3,June 2013
"I visited Boracay with my family and friends during the summer and we checked-in at La Carmela de Boracay.  The hotel was nice, but DON'T BOOK their standard room. The airconditioning was crappy and the staffs was not that attentive to standard -booked guests. I noticed the difference because the first time we booked there, we were upgraded to premium suites and the hotel staffs were so friendly. but the second time when my family booked the standard room, we have to call the front desk three times before their staff can accomodate us. its like we were put on the last of the list.  we don't feel prioritized at all.  the overall, its an average hotel if you like to mind your own business.",3,May 2013
"Pos:  1. Good location. (But no sea view, even from junior suits) 2. Rooms very big and airy. 3. Toilet quite big and clean, with a bathtub in the junior suit 4. Active reception stuff and support stuff 5. In room safe, mini fridge. 6. Breakfast good, but the spread OK, not excellent. 7. An excellent drop-off facility (not sure if they have a pickup facility) 8. A small swimming area (pool) 9. No smoking rooms. 10. The paid buffet dinner available at the beach was excellent.  Cons: 1. AC was very week and took almost an hour to make the room comfortable. 2. No drinking water supply in the room. Required refilling from a dispenser in the corridor. 3. No hair dryer. 4. Quality of toiletry provided was not good. 5. Required a security deposit in cash (peso). Not mentioned…",3,June 2013
"We stayed here during the holy week, 2013. we have kids in tow and Its been our 1st time to stay in a hotel at boracay. I chose this hotel typically because of the pool and was expecting to have lesser worry on the food because they have a restaurant. Ideally, i have booked this on november, thats why im expecting a preferred priority on their list. To my dismay, on our arrival, we were not given adjacent rooms. I asked the receptionist about my situation and she just shrugged and told me that the rooms she gave to me are located on the same floor. I was tired to argue, so i just accepted it. Be aware of this common problem to management not handled by foreigners. I have travelled with my family but this is the first time that we had a room apart....luckily on the same…",2,March 2013
"The room we stayed at which is supposed to be an ocean view room was priced a bit higher than what we got. There were no view at all as the balcony is facing the pool. It was a bit small, given the price. Breakast was so so. It's a set breakfast during off peak season and you will have to pay additional fee to avail of the buffet which I highly discourage guests to avail. They offer just around 3-4 dishes including the pre-cooked scrambled eggs.  Pool is old, couldn't really recommend it. Service is slow. They charge for wifi and all. Bathroom does not even have a shower curtain.",2,July 2012
"We checked out because we were disappointed of their service and how they treat customers. It was a very tiring day when we checked in because of the 2hour land trip from kalibo to boracay. When we checked it, we were expecting to get checked-in immediately because payment was made 1month ago, but to our surprise,front desk said they didn't received anything. So,we had to open our emails to show to them that it was emailed and sent to their account.It took 2hours of waiting until they gave us a room. They gave us a room at the 4rth floor--they claim it'll fit 6 people but i think it is not. Another unfortunate event is that, their elevators where not functioning!My parents are already senior citizen so climbing back and forth is not safe for them. So, to my dismay, I requested…",1,May 2013
"I cant believe there are some positive reviews of this hotel. Many Philipinos stayed there on domestic holidays. Maybe they do not know what an international standard is.  I paid about $100 per night. I paid a fair bit extra for an ""ocean view room"". There was NO VIEW of the ocean at all, however, if you walked out onto the tiny balcony you could JUST see a bit of sand.  Despite paying for several nights in full via agoda, I had to pay 2,000 pesos as a cash deposit.   The buffet was simply digusting.  The air con was so bad that I had to sleep with a wet towel over my body to get cool.  They do not make up your rooms unless you request it specifically. And they wont do it unless you are in the room at the time. This means you have to waste an hour watching the maids make up the…",1,June 2013
"Because we had booked two rooms, we wanted them close together and they told us at reception that it would be and it was which was great. But one of the room had rats crawling behind the walls really early in the morning so we asked to switch rooms. The people who helped out with moving us and bringing our bags to the room were lovely.  However, to sit a group of 7 people at the buffet on the beach did not happen and we were standing in line for so long, when we were told by a waitress that a table was free another waitress put a smaller group on the big table we were going to sit on. We ended up just eating at a different buffet next to the beach.  Have to say, it was only a short walk to all the activities in station 3 so we were happy about that. I would not go back there…",3,December 2012
