reviews,ratings,date
"I was immediately met at the airport by a staff and was on my way to boracay in 5 minutes. I didn't have to wait for other people from other flights just to fill the boat... I had it all to myself! We were given a room upgrade to premiere west which we were happy about because it had a balcony where you can dry your clothes. Room had coffee and tea facilities, mini ref and a mini ""dining"" area with a table and 2 chairs. Bathroom was spacious enough. They had a purified water dispenser per floor which was a real convenience because you can't drink the tap water and bottled water is kind of expensive there. There was a pitcher in the room and we just refilled it once in a while.  It's just a few minutes walk to D'mall and it's surrounded by restos and near 7eleven (!) The…",4,October 2016
La Carmela is an average 3star hotel located at Station 2. It will take you  about 2-3 mins to go the beach. They provide basic toiletries like shampoo with conditioner and soap. Basic room with mini ref. Breakfast is not that good. Staff were accomodating and friendly. ,3,October 2016
"I booked La carmera hotel through ASIA TRAVEL portal after finding it in trip advisor site. I stayed there for 3N and 4 days and it was good .  I took standard room and for that price plus  close to beach i felt it is worth for every penny. You will be charged 100 pesos for wifi if you use in your room . For free wifi you have to come to reception or Dinning hall.  For transportation ,If you inform them (you should call ... they will not respond to mail) prior they will arrange  pick up and drop from kalibo airport to Le Carmera for best price. outside travel agencies will charge slightly more compared to them",4,October 2016
"I was hesitant when I was hesitant when I've heard that we were booked for 2 nights here in La Carmela because of the bad things that I've read and the ratings that the hotel got here in Tripadvisor. We were given an overnight stay for free by my partner's company, so I was thinking maybe we can transfer to another hotel on our second night. However, the second night was already booked, and we can't do anything about it.   This is our second time in Boracay, and this time, our transfers was taken care of by the hotel. We arrived early in Caticlan airport, so when we got out, our Van was not yet there, but we didn't wait long anyways. There is not waiting for other passengers, no schedule for the boat or the van before taking off. We were in the hotel in no time. It was so…",5,October 2016
"The resort is huge and they have different .. and during our visit the hotel is quite full and cause massive breakfast..other than that is was a very relaxing stay. The place is very accessible to the center point, bars and restaurant including night parties. ",3,October 2016
Group travel for rest and recreation in Boracay on a budget is perfect at La Carmela de Boracay. No frills resort-hotel at station 2 beachfront complete with buffet breakfast and some good amenities too!,4,July 2016
"""La Carmela de Boracay, ist the Boracay hotel, that you would like, if you like near the beachfront location.  Many Europeans have stayed here, in the past few years. The service staff, is good. What is nice, is the location near the Station #2 beach front.""",4,November 2015
"The Boracay is the most Beautiful beach in the Philippines, there is a more Island you see the boracay, Boracay is summer of tourist, because many pool and beach its so beautiful and can see the foreigner like USA, Japan, Singapore, etc.",4,December 2015
"At first I was afraid with the negative feedback I've read with La Carmela, because we've already settled our payment for our accommodation here, but I believe that some people are just expecting too much.   We stayed there for 4 days, and I would say that the SERVICE is really good. Staffs treat their clients like a boss. Take note that our 4th night is free of charge, via TravelOnline :)  Their BREAKFAST is buffet type, which is really good, generous, and has a lot of food to choose.   The TOWEL which is the topic of most feedback is not that old! It may be not that white and very new, but you cannot compare it to a rag! Maybe some people are just looking for a one-week old towels to use! Hahaha!    Don't believe the negative comments unless you see it with your eyes. Shall I…",4,October 2016
"Hi, we stayed in La Carmela de Boracay from Oct5-11, 2016 with my sister, niece and nephew. We stayed in Executive Deluxe 2nd floor near the entrance and the pools.. here's my overall review  Internet Connection - 5stars - there's no problem with the wifi connection (room,poolside,seaside). (they gave us 2 wifi cards for 6 days - the card is good for 24hours and 1 gadget per card). Its part of the package that we got.   Breakfast - for me its a 4. They changed the main course almost everyday (chicken, beef and soup)  Room - 4 (the room is clean although the mirror in the bathroom is too old) - The bed is okay we have 2 double beds - enough to accomodate 2 adults per bed. - water supply is good - aircon is average - pools (they have 3 pools and we really enjoyed it alot)  Service…",4,October 2016
We stayed in La Carmela and it was in the middle of the beach ocean frontage. the location allowed us access to everything along the water front. the food was good but not being a fan of Philippine cuisine I had a hard time with food just at the hotel. My wife however enjoyed her meals. The rooms were clean and comfortable. The quiet times allowed us to enjoy our room and get much rest between activities.,4,October 2016
"its an affordable beachfront hotel but its a trap! we went back to our room to charge and rest for a while. little did we know, almost all of our things are wet and we didn't know exactly where did the dirty water came from. even the telephones, the bible, the bed, everything was wet except for those things inside my friend's waterproof bag and some things inside their cabinet. it took them hours to finally respond and transfer us to a new room. the only reason they could give us is that it rained so hard(very reasonable, right?). at first they wouldn't even want to refund us and replace the wet chargers and power banks(they still owe me an apple charger and they're ignoring me now). you need to deposit 2 thousand pesos for incidental charges (i.e. henna tattoo stain, lost keys…",1,August 2016
Location is great as it is at station II (Beach Front).Transportation arrangement to airport and vice versa is well organised. But the room just basic. Strange thing the bathroom have funny smell. No free wifi. Breakfast buffet just an average. Staff service is just ok.,4,December 2015
Located very close to the beach which is just great. We stayed at this hotel for 3 days. Hotel is not very luxurious as the name but is kinda ok. Breakfast is good. Service is not up to mark.We had to even ask for water several times. ,3,October 2015
"La Carmela is a nice place to stay if you are a budget traveler. The rooms are large and beds comfortable. Bathrooms are clean and spacious.  Staff was nice and polite however, not very prompt in taking actions upon requests.   Please keep in mind you have to request if you want your room to be serviced during your stay, they do not do usual room service as in other hotels.   The location is great, very close to the beach and restaurants and night life.   The security is not very good, we have been hassled by many people who wanted us to buy things from them, so there was not that much peace around. We were also hassled by people he tried to sell us drugs on the property of the hotel. When reported to the security nearby they did not seem to be much concerned about it.    You…",4,September 2016
"special thanks to travelonline  for a hassle  free vacation and boracay is a good place to visit specially the nature and water adventure that they offer also the locals and very accommodating and friendly, we enjoy a lot for 4days and 3 nights stay in the island.",4,September 2016
Thank you TravelOnline for our hassle-free weekend spent in Boracay. and to Jyryx Nama (agent from alabang office) for a fast and hassle-free transaction. 😉 good job guys. God bless you all. we will definitely be choosing you again for our next travel. 😉😘  from a satisfied client. I highly recommend TravelOnline. (lots of freebies as well) 🍕🍧🍛  La Carmela is a good choice. We were booked with a standard room and was upgraded to deluxe executive for free. Located at station 3. Around 15 mins walk to D'mall.  Only prob we experienced is the random power interuption. . And the AC is on fan mode.,4,September 2016
"Room is big and we expected to have 4 double beds but it turned out there were 5 - which is better. Pools are okay. Thumbs up to the location. Beachfront 👍🏼👍🏼 We were 8pax in total and we stayed for 2nights. Per day, we were given 4 complimentary breakfasts. I asked if we could just have all 8 in one day and none on the 2nd so that we could eat all together, but they said bfast is non transferrable. I felt really disappointed.   Pros: Location, room size & food taste (buffet) Cons: CR smells, aircondition not working properly, no extra key (meaning the moment you get out of the room, everything will shut down and it will be too hot upon ariving in your room)",3,September 2016
"This hotel looks great but is not managed well at all.  I got a large corner room, Super Deluxe (room 301 I believe it was) and upon arriving in the room there were ants all around the perimeter of the room and crossing the middle of the floor and the lighting was terrible, like a creepy movie hospital.  The hotel was responsive to killing the ants with a really potent spray that stunk up the whole room (so toxic).  Then I took a shower and the drainage was terrible flooding the entire bathroom and nearly going into the bedroom.  I switched rooms (to the room directly above - 401) and the problems not surprisingly were the exact same, ants all over the room upon entering and terrible water drainage such that a day later I switched rooms to the more expensive West Wing.  It was a…",1,September 2016
"Even though it is one of the cheapest beachfront resorts in Boracay, we still think we didnt get the value of our money. Rooms were small and dark, hallways were narrow, food was bland. Not recommended.",2,September 2016
"I recommend this hotel for they have big rooms, clean bathrooms but the thing is the toiletries, they only have shampoo and soap then bath towels is not free. They charge 25 pesos per towel. For the breakfast buffet, the food is good, they serve a heavy breakfast buffet. Overall rating would be very good.",4,September 2016
It's a good budget hotel for travelers that wants to save money or spent less money on vacay. They area is close to the beach (literally at the beach front ) the room is ok but they need to change linen and towels. They have free purified water on the hallway. Breakfast is ok too not that special. The pool is not exactly what it look like in the pictures. I recommend this hotel for those who have small budget. Because you need more money on buying food and drinks on the island. Food too expensive in boracay.,3,September 2016
"This hotel is overrated. Room so-so,loose toilet seat, cranky faucet and ants everywhere. Wifi is not for free, P100 for each gadget. Breakfast was okay, since it was free. The pool looked dirty. Not worth the money.   ",2,September 2016
"The hotel is acceptable for its price however if you're not ready to walk 2 kms. just to reach Station 1 to swim, better stay away from this hotel. One thing I don't like most is there's no LTE or mobile data signal or wifi inside our rooms. We stayed in the 3rd floor of the West Premier bldg. for 4 days from Sept 9-12 and their elevator was out of service the whole time. Breakfast is so so, mostly eggs every day, they didnt even bother to offer a different variety.",2,September 2016
"near to beach, small room, small pool  this rresort is near to boracay beach  and stay in station1. but little bit far from downtown (d-mall) need walk almost 10 min. and not much helped to guest. no have any activity programs. just only room and meal. ",4,September 2016
the staff are accommodating. the room is not what i expected to be. no signal and better if they could provide wifi inside the room. i stayed outside in our room to get better signal of wifi but when i came back to our room too many bites of mosquito. but   its budget friendly and near the beach.,3,February 2016
"Room - it is obvious that the hotel is under renovation during my stay. My room is situated in 4th floor, it was okay though the aircondition system is too noisy that I need to turn it off so I could rest.  Location & Amenities - La Carmela de Boracay is situated in a very strategic area of the island. The hotel has a beach front and offer 3 different pool for their guest.   Services - it was superved. All of the server from FnB, Housekeeping, Hotel Greeters, Receptionist are very approachable and helpful.",3,August 2016
"My godddd I could not believe my eyes! The room was just disgusting and smells terrible! None of us wanted to take a shower or use the toilet as we could not take the smell. It's just so filthy! The pillowcases, bedsheets, blankets and towels are not white anymore they are gray! Impossible to sleep on! It just looks disgusting. The room was dim due to poor lighting even in the hallway. The entire building just smells terrible. Almost seems like a public eerie abandoned hospital. No phone signal inside the room, they will charge you for wifi use and towel use for the beach. The swimming pool looks dirty too. Oh my god. If they could not afford the maintenance they shouldn't have built such a huge hotel.",1,September 2016
"The place was cool to crash and was close to the ocean. Bad part no free wifi. Breakfast was ok. Would I want to come stay at this hotel again probably not. The wifi really bothers me and looking at some of the rooms in the neighboring hotels, I'm willing to pay a little more for convenience.",3,September 2016
"The hotel was near the beach, the market, water activities, and some restaurants. Everything was really accessible which made our stay for four days enough to enjoy everything that is in Boracay. Also, the amenities and the room was good. It is suitable for backpackers like us. You can relax anytime because you will not hear the noise outside. Most of all, all the personnel were really nice. :)",4,May 2016
"Yes, as the saying goes, you get what you pay for. Location was very ideal, but the facilities can still improve, especially the rooms on one of the wings, where me and my family stayed.  CONS - Instead of a keycard, they use the traditional key, with the card attached to it to activate the electricity. - We were promised by the reception that we would get COMPLIMENTARY BOTTLED WATTER. Alas, we found out that they only give those to guests in the more expensive rooms. VERY VERY MISLEADING! - Hallways are very dim. - There were ONLY 2 SOCKETS in our room. One in the bathroom, and the other one near the door. - WIFI IS NOT FREE. You have to pay 100 PESOS for access that is only good for 24 HOURS.  PROS - Breakfast was okay. They always replenished the food. I just hope that next…",3,September 2016
"Went there during summer. it was really comfortable and affordable for my family to stay for at least 3 days. They accompany us well, we feel really special even if there are a lot of people staying. The food they serve are amazing. It was really nice and comfortable.",5,April 2016
"La Carmela has an old type of accommodation that uses the traditional key for the door and not the keycard type. The room that we stayed in also does not have a cabinet as you'd exect. The staff are kind and accommodating which made the stay worth it. However they are not responsive when it comes to online and landline inquiry. Nobody's responding. Not even their FB page. When my friend messaged them a week before, they responded when we were already on our 2nd day in the hotel.",4,July 2016
"Nice hotel, the staff was so good to us, they even let us stay for a few more hours, i guess it wasn't that busy on that day, it's worth of your money! Beach front hotel are awesome! It's very near to the establishments in the area especially the D'mall! ",4,March 2016
"Nice Hotel, Friendly staff. Groceries,shops and restaurants are near. Free breakfast buffet is okay. Plenty of East Asian tourist though and they're sometimes noisy at the hallways at night when you want some much needed sleep.   I don't know why but in our last day just hours before we checked out we don't have running water in our bathroom.  Stayed there for three nights this Holy Week.",3,April 2016
"La Carmela is the cheapest beachfront hotel with a pool. The rooms are okay. But since we stayed here for a week, it's a bit inconvenience for asking them to clean your room since they won't clean it when you're not around. The pool have strong chlorine. The breakfast is not the best, but you could get what you pay. Staff are nice. If you're on budget then La Carmela is the best place to be...",5,September 2015
"We checked in this hotel a week ago and I could say that checking in and out of the hotel didn't take too long compared to other reviews I've read in the comments.Staffs were friendly and provided us the necessary information we all need regarding our stay. The hotel is a beach front and an easy access to the beach. Overall stay is good, you can request for everyday housekeeping...",4,August 2016
"Stayed here for two nights with my officemates. Staff are very welcoming. The location is very convenient. Booked thru agoda and we have not encountered any inconvenience from the start. The room price per night is just right given the fact that breakfast is free. Frontdesk services is open 24 hours as well as the restaurant. So if you ever get hungry in the early hours of the day, you need not to worry, just a call on the frontdesk. Breakfast is just okay, hey it's free! ",4,August 2016
"perfect for your vacation and great location , beach front looks really fancy and I advice by this hotel , not easy to find you should check many websites to get the best Price for it ! check the weather before you go that's the best Advice I have for you",5,August 2016
"This is a celebration of Friendship,  T'was 8 years of Sharing Happiness,  Loneliness etc.  We decided to experience a different way of Celebration.  During our 2 night stay twas a very remarkable and a pleasant stay,  everyone is so Hospitable in all fairness. Thumbs up / Kudos to the team.  Hope everyone will enjoy as well the Ambiance,  the service and view of the Property 😊👌",5,May 2016
"If you're looking for a place that's cheap and clean, this is the right place for you. I don't recommend though. room and t&b is not very spacey. but the hotel is in the right place of boracay. Its our first time here and i guess we will be back if the budget is tight...",3,October 2015
"Begin by check in very rude desk workers Your room at the ""Executive Wing"" Extremely dirty full with bugs  No toilet paper you have to begging the housekeeper Most of the time no running water for shower or flush toilet  Breakfast buffer disgusting I will not give this food my dog I try to dinner exactly the same  If you like to go to the beach you have to pay for a towel nobody cares about the tourist taking the money but  exchange for service I going for over 20 years to boracay from trip to trip it getting worst",1,August 2016
"Stayed there for 4 weeks. Stayed here because it was all inclusive and had 3 pools. They always turn on their generator, which is not a real generator, as it just allows emergency lights, even where is no storm. Phone didn't work for 5 days, nothing fixed, water pressure in shower is the worst I have seen-drizzled hot water, shower often backed up flooding the floor, staff argued with me that I was not allowed to use my own electricity I paid for, ""No sir, you can't use continuous electricity"" when I wanted to get a tattoo in my room, even though there is a refrigerator, free wifi only works with mobiles, not my new laptop, almost everytime I asked for something, they failed miserably, buffet breakfast repeats every 3 or 4 days, food has lots of bones, they don't replace food…",2,July 2016
Very good choice for couples. They have also the lowest (the last time I checked) transfer rate. Only that during bfast some trays were left empty for a long time due to numerous guests. But I'll still recommend this for sure.,4,November 2015
"I'll start from our pick up from airport. Since we were a group of 8pax, we were picked up by an air conditioned van--that was a plus.  Then sumakay kami ng kanilang big bangka who could accommodate a big crowd. That was impressive.   When we got to boracay island,sinalubong kami ng tour guide and led to our van that would take us to La Carmela. Seeing our van, I was like ""Huh? Pwede na itong silaban sa kalumaan ha."" One foreigner who went with us was sweating really bad dahil hindi lumalamig ang aircon, we were sweating like pigs! Yes nasa pinas ka pero kung ang buga ng aircon ay apoy, thats a different story.  Resort: front desk  managed to checked us in earlier. Kudos to them.  Room: We stayed at deluxe standard rooms (on of my the rooms hindi gumahana ang aircon. Maintenance…",2,February 2016
"Ok hotel, the place has a strong smell like Liquid laundry softener (if you know that smell) Location is very good because its close to everything. Friendly staff, they were able to help us during a medical emergency. However we waited for a while for check in  (I understand as it was peak season and we came a little early)",3,May 2016
"Which is a basic room to sleep in after spending all your cash on food and activities.   Cons: There's no water/coffee in the room, there's barely any toiletries, breakfast buffet is bland, the A/C's not that cold, and they DO NOT take credit cards!!! You have to pay for the WiFi if you want to use it in your room, too.   Pros: It is, however, a one-minute walk from the beach, near amazing food places and souvenir shops, bars, etc. The location is rly A+.  They also offer to hold your baggage after check-out if your flight is not until nighttime so you can still do activities. There's a common shower you can use near the lobby if you don't wanna extend your stay and pay by the hour for the room. Again, very basic but it gets the job done.   Verdict: Would I go back? Sure, cause…",3,May 2016
"Room is just a room, nothing special. Its a place just for sleep. Ac not cooling well and no set up of coffees. Well its just fine for us since we went to Boracay just to see the beach and not for staycation. They just serve ordinary filipino breakfast and very few choices. Pancakes are served cold and not soft. Receptionist are like robots, you  cant see any hospitality to what they do. Again, its just a so so hotel. You get what you paid for.",2,July 2016
"Thumbs up for the location since it's a beach-front hotel in Station 2 (right?) for a good price. That's the best part about this hotel.  Rooms were fairly okay. Simple. Clean. Although it didn't feel homey for me. Must be the rough bed sheets and thin bath towels. I appreciated the balcony for every room. The shower/heater worked perfectly fine (since I am very particular with comfort rooms). Water dispensers around the hotel were convenient for us, too.   The pool area is small, crowded and too open. They don't serve ala carte breakfasts until 11 am. They serve buffet.   We didn't have any meals in La Carmela. Didn't hang out anywhere in the hotel. I can't even say anything about the staff cause I only encountered them while checking -in/out.  I'd come back and book again…",3,July 2016
The hotel staff were friendly and accommodating.  We enjoyed the promo price for our room. Value for money. But the buffet breakfast did not suit my tastebuds since i don't like spicy food. Perhaps it was because most of the hotel guests were Koreans.,4,July 2016
"we enjoyed the stay on the island..very accommodating staff... hoping we can come back soon... my kids also had fun,they enjoy the water very much,they tanned a lot... thank you...great choice for travelers...",4,February 2016
"I've stayed in La Carmela twice before thus decided on a third stay which proved to be disappointing. Now that they have expanded, service is no longer personable. You, the guest, is a money-making entity! Let's start with check-in. Immediately, I was slapped with a Php 2,000 refundable deposit. That DID NOT exist before. They claim to have free wifi - but was told it only exists in the restaurant and main lobby.  We stayed 4 days and was never able to connect. A guest can avail of wifi in the room for P 100 (if i recall), good for 4 hours , i think, 1 gadget only. Aarrggh! 3 people in 1 room = 1 gadget?!! Go figure. Last but not least, ultimate check-out is at 12nn. The Receptionist claims she was calling me for a reminder prior to 12nn when actually she called at 12:45pm. By…",3,July 2016
"Crowded because the price is cheaper than other hotels. The pool also crowded. Breakfast buffet was fine but the same food everyday. The room we slept in was dirty (i saw a cockroach). THE BUILDING WAS COMPRESSED SO THAT PLENTY OF ROOMS WOULD FIT IN!! Very congested. Ourbalcony was facing a wall, it was hot inside the room and no air! To be fair, the staff were great.",2,April 2016
"The room size is big and its just less than 5 minutes walk to the beach. The staff are friendly and the breakfast is not that bad. For the rates they charge, its very reasonable. The only set-back I can think is the presence of mosquito in the grounds that find their way into the rooms. Other than that, I give this place a thumbs up!",4,April 2016
