reviews,ratings,date
"Stayed for 4 days with my family, friends and a guest from the US. It was a painful and terrible experience!!! I am a returning guest, stayed a year ago with friends. My stay last year wasn't that smooth, the aircon in our room isn't fractioning well but other than that all was OK so I gave it another chance. That, I really regret!!! We arrived at the hotel nearly 2pm, we haven't ate lunch that time yet so we were already starving. We checked in, put our things in our rooms then looked for a restaurant. When we were eating, my mom asked what kind of room I reserved for them because she didn't like the room they got (I reserved a VIP room for my parents which is according to my booking, located at the main building and beach front and 3 premier rooms for me, my siblings and…",1,May 2015
"stayed there for 3 days and all i can say it that its just ok, not so bad from what I've read on other reviews.. Just dont expect too much and you'll be ok.. we were supposed to stay on a standard room but we got upgraded to executive deluxe room.. although the room we got is on the back end so no view on the terrace, but we got deluxe room amenities so its a fair deal. we wont be staying much in the room anyway, so why look a for nice window view. my only gripe is that the bathroom is a bit smelly, and ac takes a long time to cool the room.. we had a free breakfast which is just ok.. the staff is also just ok, although they can be busy during peak hours. you can leave your room keys with them if you're going out, which is good if you are in a big group that is not going in the…",3,May 2015
"I have stayed at La Carmela annually since 2007.  It is a budget hotel with budget hotel amenities.  Service has always been good, and actually seems to get better year after year.  This year as I was checking in I mentioned that I was a regular and was told that I would be put int the executive wing.  I thought that would mean an upgrade, not to a room with no windows.  Well we had a tub, and a coffee maker, but behind the curtains there was no window.   The room was as dark as ink.    I had booked two rooms for myself and family and both were without window.  When I asked for another room I was told there were no more available.    I had booked through agoda  - however you book, be sure to specify a room with a window or balcony.",1,May 2015
"We stayed at La Carmela de Boracay for 2 nights and 3 days, I love the place and very affordable for everyone. I would recommend for family vacation, the place is in front of the beach and they have three (3) swimming pools.",5,April 2015
"We stayed in this hotel for 4d/3n and everything was just so disappointing. They will not change the beddings, towels or clean your room if you don't request them to. The bed sheet is off white when its supposed to be really white. The drinking glass is plastic, room is not well lit and the shower heater in our room doesn't work. In all fairness, the hotel staff is polite. Breakfast buffet consists of sunny side up and scrambled egg, pancit, hotdog, some ulam that is salty, few fruits, pancake and cereal. Food isn't that good.  There was a time that the power went off so the generator automatically started. Our room is so close to it that we're not able to sleep wee hours in the morning. Oh no!",2,May 2015
"La Carmela is the place for you if you want to save on accommodations  in Boracay while still enjoying a beachfront property .  PROS: immediate access to the beach, has a swimming pool as an alternative option for the kids      We availed of the hotel's transfer package from Kalibo - Aklan and vise versa and we have no complaints. The bus was big , spacious and not crowded at all.      The breakfast food is ""blah"" to say the least . It comes free with the room so we decided to use the free breakfast voucher and splurge on lunch and dinner instead. But we sure will not pay extra for this breakfast meal and go somewhere else given the chance .        For our group of 6 adults , 2 kids and one infant we got a loft room which can clearly accommodate more. The loft area is spacious…",3,December 2014
"The hotel location is good but the service staff is too bad.I was staying in other hotel for 3night and the last day of my stay in la Carmela. Before one day I check in, and I went to the hotel reception to ask some information regarding the transport and direction. I meet few staff just to ask where is their reception so I can check about my stay on the next day but few of them give me the different direction here and there is really confused for me.and they have No greeting and smile at all. Once I have approch to the reception to ask the transportation from my current hotel to their hotel, they just straight away answer to me there is No transport for me Coz there is not available without checking ,on this point I can said they are really not helpful.  The next day i check…",1,May 2015
"We stayed for only a night in this hotel but I have a lot to say already. Bad - free breakfast was awful. It was not appealing and delicious at all. Take breakfast somewhere else. Elevator in the East Wing was inoperative during our stay. Room smelled old though they said it's the newest building. Bed sheets were not as white as it should be. There are like stains that weren't washed properly. Our room doesn't have enough lighting. Though there were four light bulbs in the room, it was still dark. Bathroom door was squeaky noisy! They had so many rules that aren't even the usual hotel rules (no house keeping if guests are not in the room, etc.). Good - they checked us in as early as 9 to 10am without additional fees. Our standard room was upgraded to premier deluxe - also free…",3,April 2015
Ice stayed in the shangrillas and regency and lagoon hotels on boracay. Though the rooms are very basic  i found it one of my most memorable atays on the island. Its a phillipino getaway for the most part. The staff are very good and the fact that your literally just off the beach is a major  asset...the service to the room is a fair..but the food in my opinion was awfull...however ..as my room was  quite cheap  i used the many establishments off the beach to feast. I would go there again And why....the staff were great and as it was filled with mainly philipinos i was surrounded by wonderfull happy souls,3,April 2015
"We had a wonderful experience with our vacation to Boracay. Thanks to TravelOnline. From arrival until departure, somebody took care of us. What a great experience.The hotel staff are all hospitable, great foods and a surprising welcome drinks awaits you upon your arrival.",5,April 2015
"I have stayed with La Carmela de Boracay for three times as far as I can remember.  All bookings were with a large group as La Carmela offers cheaper promotions for group packages.  We had an office related affair and we were a large group of 62.    What I like about our last booking:      1.  Location, as La Carmela has direct access to the beach front and strategically located between Stations 1 and 3.      2.  Staffs were accommodating and room service was good.  We ordered additional towels and it was delivered in a matter of 5 minutes.      3.  Passable bed  What I do not like:      1.  The food was a gastric catastrophe and I am not exaggerating.  Two of my friends spilled their food out as they had stomach upset.  It felt like eating recycled food.  Our group package came…",2,April 2015
"Stay away from this hotel. We stayed here for two nights. The AC is not cool, the bathroom is flooded every time you take a shower and the worst of all is the food they serve.  Our accommodation comes with a breakfast, lunch and dinner buffets for three days and we noticed that they were serving recycled food. The food is really bad. Hotel services is not good.  We requested early in the morning for room cleaning and they told us due to the volume of housekeeping requests, room clean up will be scheduled at 5pm. They also have policy that we should be present while they clean the room. Duh? Why hire employees you can't trust? We never got our room cleaned because we have no time to wait for them to clean the room. ",1,April 2015
"Booked our vacation thru A Whole New World Travel Express(highly recommended for stress and hassle free) and stayed at La Carmela for 2 nights. Staffs are very friendly and accomodating. Our room was big enough for 2 pax.. room/bath/toilet are clean w/towels and some toiletries. Aircon is good. Free buffet breakfast is great. The hotel has free water refilling station for drinking too. Hotel has cash bond of 2000pesos before you can check-in but once you check-out, they will give it back. Free wifi was very slow but it's as they will still allow you to stay at their lounge while waiting for your flight/transfer. ",4,April 2015
"We've stay here for 3nights, we got good deal on this hotel and very reasonable..the hotel is beach front and convenient to all...staff are friendly and accommodating...must try this hotel for your trip in boracay..good cost with good quality....boracay is love love love...",4,April 2015
"It's good for what it's worth. It's not one of the best hotels, but it's close to the market and only steps away from the beach. They have continental breakfast, but for only 2 guests per room, which is kinda dumb.",3,July 2014
"On the positive side : spacious room. I did not have any problems with towels as other tripadvisor contributors. Next to the beach, but can be reached with your vehicle. I could enter the room early with no charge. On the negative side : the flyer with the explanation how to use the safe is not correct at all. The aircon seems to have problems keeping the room extra cool. Breakfast could be more tasty and is not very warm. Conclusion not bad for the price and location.",3,April 2015
aside from the hotel is affordable i can sy that the money u pay is worthy. my package includes 3 days 2 nights accomodation in la carmela i stayed in the east wing that was a quiet one if you like privacy and the service of the hotel is so nice. when i called the frontdesk for some services like to bring water etcc they immediately response its a matter of being good communicator thats why i never encounter any probs especially when they call for my land transfer they even assist me for that. they are hands on even for the transfers of clients to their corresponding company just like mine island star express. thanks to traveldotcom it was a nice deal,5,April 2015
"buffet breakfast, absolute beachfront, drinking water available at every station, very good budget hotel for families and friends alike. good value for money. near resto and bars, right in the middle of boracay, strategically located at station 2.",4,December 2014
"Stayed here March 2015. I´ve been to 39 contries in my life and stayed at MANY hotels. This was the worst hotel experience ever. Let’s start from the beginning. We were going to stay here a lot of nights but we checked out earlier after 4 days. We arrived early in the morning and was told to come back at 2 pm because our room was not ready. It was ok but when we came back at 2 pm the receptionist was not sure our room was ready and has to check. After several minutes she told us that a room was ready for us and that we were upgraded to a better room, free of charge.   But before we could get our room we had to sign some house rules that they had. For exampel; They don´t clean your room and if you want your room clean you had to call the reception and they MAY clean your room,…",1,March 2015
"Though there were cheaper hotels nearby, we still chose La Carmela for having better facilities. If you're tired of going to the beach, you can also take the creative designed swimming pool. The building was good and the staffs were very accommodating. When we arrived, it was a whole day brownout but then the hotel was able to provide generator produced electricity for the entire day. The only problem we encountered was the busted sink and low water pressure. I don't know if low water pressure really happens in the entire island or it might be because we were staying at the 4th floor.",4,January 2015
"I was also a victim of this idiot.  We stayed at Two Seasons, quoted us a package for 4 but turned out only for TWO! He was also banned at the Two Seasons.  He will do anything to steal from you. He has full of promises but when we got there, 2 of my relatives doesnt have any room, doubled the fee of the ""package"" but turned out the 2 were only for the airfare.  What a scammer!",5,May 2014
"Although there are better hotels in boracay, for the price you are paying in la carmela is worth every penny. They have 2 pools with lifeguards, very good for travelers with kids. Staffs are very accomodating. Room is big with 2 queen sized bed. We actually slept only in 1 of the bed while our baggage are on the other hehe. Nice clean room, clean toilet, hot shower working fine, soap, shampoo etc are provided. Why did i give only 4 rating? Because of the buffet breakfast. I can barely swallow the food, good thing is they allowed my son to eat for free even thou it's stated that only 2 per room are considered. (They must have realized that i will not eat anything haha). Overall it's very good, I already booked with them this coming april. Im recommending this to friends who are…",4,April 2014
The room we checked in doesn't smell nice. It's supposed to be a happy summer holiday but went south. The location is good. A bit pricey. Complimentary breakfast was good but then the crowd is overwhelming.,2,May 2014
"Overall the experience was quite okay except for two incidents. When we arrived at the front desk the 2 ladies behind the desk: were not even smiling (hey we're tired too and adjusting to the heat) the other  one was just texting. On  our 2nd day we opted to have our hair braided. We were told to have it done under the coconut tree where we are to sit on a molded cement. But unfortunately the bright sun was already scorching on that spot so we requested to have it done on the plastic sofa provided at the front beach. While the braiding was ongoing at 10:45am March 13, 2015 a guard by the name of JV PERUCHO approached us and reprimanded us. We kindly and politely told him mainit na yung place na pilit nya lipatan namin. He ARROGANTLY told us 'MAGPALIT NA TAYO, KAYO NA MAG GUARD'…",3,March 2015
"The room was a decent size as we stayed in the executive wing. Had a balcony for smoking and drying clothes so thats awesome. Bathroom was decent as well with a bathtub that was fairly clean. Cable TV was available for entertainment. However we had 2 queen sized bed when one king sized one would be perfect.  However the 2 beds came in handy when we had the awesome and cheap in room swedish massage that we had every night!!!!! Breakfast is not too bad, and executive wing gets their own dinning area thus you don't have to squeeze with people in the main wing.   The room service was awesome too the mango smoothie was heavenly! However, i requested for wine glasses and they gave me normal orange juice glasses.   Staff were friendly and really helpful. I had a deep cut from falling…",4,September 2014
"We booked la carmela the executive wing thru agoda.com. and a cording to the pictures and the review, it seemed like an nice hotel. When we got our room both me and my boyfriend noted the light smell of mould. As I entered the bathroom there were a small family of cockroaches and ants. The air conditioner was a bit noisy. And the breakfast wasn't the best. I would've wished for more continental buffé. The rooms all in all needs a renovation. And the first thing they asked us was if we wanted to upgrade our room because they were building on a new property across the street. Of course for an extra fee.. as if 2500 peso per night wasn't enough for such low quality rooms.. I'm advising you to look around before you book!",1,February 2015
"We were initially shown a tiny room, dark and depressing with old fixings and dirty water in the lavatory, having asked for a new room we were shown an exactly similar room both in the 'executive' suites. Upon 3rd attempt we finally got an acceptable room in the west wing, this still had evidence of previous guests with hair bands(hair still attached) in the bathroom. The internet that was advertised was non existent in the room, and was very poor speed in the lobby for the whole 2 days. The buffet breakfast was adequate but repeated on me all day, and we didn't bother on the second day. It was an absolute mission just to get a coffee from breakfast station, with rules rules rules about entry without a ticket, taking it to the lobby ( I was forced to drink the tepid liquid in…",1,March 2015
"Me &my family stayed at the main  bldg for 3 days. The room was decent enough; the bed is ok with not so good beddings;toilet and shower were fine.There's a small safety deposit box which worked well.There's a telly,small fridge,4 towels.A small veranda with plastic table and 2 monoblocs. AC worked very well. Breakfast was fine but the coffee was bad.The staffs were friendly enough and they've attended to our concerns pretty fast.Overall,this hotel is okay.",4,March 2015
My husband and I just stayed here for 4 nights out of our 9 in Boracay. Although the location was awesome. NOTHING else was.  the rooms were clean and they had cable tv. La Carmella is not worth the price.  This hotel was insanely busy and the pools looked filthy. The breakfast was disgusting. Pretty sure it was left over buffet from the night before.  The wifi doesn't work. It says when u book free wifi in the lobby Which is fine. But no there isn't! They tell you it's down. They told us they would restart it more times then once. Bull$**t!!! We spoke to another guest having our same issue and he broke down and paid for it. Then it worked just fine all over the resort.   We had to go to another resort to make our travel arrangements  We would not suggest going to this resort to…,2,March 2015
"My friends and I were supposed to stay in Boracay Travellodge, but as we arrived they transferred us to La Carmela instead because the room that was alloted to us was not yet ready. Actually we were excited about it because La Carmela is near the beach. The room was clean but nothing really special. We had issues with the bathroom since the floor will easily get soaked when you open the shower but no problem with cleaning since we can just request for a cleaner anytime. The aircon was not really cooling at night as well. Breakfast was ok but nothing really special plus there are so many guest there. It was not easy getting a place to sit. Staff were really nice and helpfull. They let us borrow umbrella for a deposit of 200php and they gave us transfers from hotel to kalibo…",3,March 2015
Stayed for 3n/4d with family and a friend in 2 premier double room. It's in  the new building so the room is nice but not in beach front. Breakfast is ok and the pool is kinda small. It's an average hotel for me but its already good for its price. ,3,April 2014
"DO NOT STAY HERE CHOOSE BAMBOO BEACH RESORT FOR BEACH FRONT OR AZUL BORACAY OFF BEACH FRONT (and they are much cheaper)  My wife and I stayed here for 4 nights (wanted to move but didn't want to waste monies) ""free"" wifi doesn't work ever so you must pay for the upgraded wifi. Breakfast is awful (cold eggs and whatever is left over from dinner the night before) black tar coffee  They tried to charge us for beach towel rental upon checkout. I refused.   Too many people. Rooms were clean. But that's about it. Oh and tap water smells like swamp water.   STAY AWAY YOU HAVE BEEN WARNED ",1,March 2015
"Every year that we are visiting Boracay we always choose La Carmela,the executive wings,the place are quite the pool are good for kids.its good for family if your looking only is for relaxing as no noise since no bars at the hotel. The location is great as it is very close to the beach and in the middle of almost everything. But needs only to be more trained staff specilally the front desk!!! since we had reservation we suppose not to wait for long and specially we are regular guest.and also the room must do general cleaning as sometimes sand still on the floor...bed sheet daily change must.",3,April 2014
"There are really a lot of tourists checking in  at this hotel since its budget friendly. I booked thru hotels.com, I showed front desk my text confirmation and email confirmation details of the booking but she did not honor it. Instead she let me wait standing in front of her for nearly 30 mins. Guest beside me waiting had the same problem. I think they are just lazy searching our names on their guest reservations list. Good thing I remembered I had a screenshot of the booking saved to my phone, if ever, I think they will let me wait longer! While I was waiting, I have observed a lot of complains from guests that were given wrong rooms. Anyway, their rooms are okay, nothing special and location of the hotel is excellent to access to everything in the island.",3,February 2015
"We were here last dec2014 & i may say we loved the beach,but i was just quite disappointed since i live abroad & heard a lot about La Carmela.we made the prenotation while we were still here in Milan.When we arrived we stayed at the rooms going to the dining area.Found the bathroom with hairs on the floor.But i may say all the staffs are courteous & helpful in everything.To sum it all it was a total relax & vacation.",3,December 2014
"Spent a couple of nights here with my brother. The location is great as it is very close to the beach and in the middle of almost everything. So, if you come to Boracay for some peace and quiet, go somewhere else.   Our accommodation was basic. Nothing fancy for such a rate. The thing with La Carmela is it can be really crowded that guests outnumber the staff - big time. I don't remember during our stay (no matter how short that was) of any housekeeping staff to check on us. We did get a welcome drink and escorted to our room. Other than that, nothing. Staff (if we ever saw one) would just pass by and move along. I don't expect a royal treatment but IMHO regardless of everything (except I guess when the guests are really rude), the hotel staff should always be warm and friendly.",3,March 2014
"I stayed here with my best friend for 4D 3N. Staffs are very approachable and polite. Rooms are clean and nice. Hotel is infront of the beach, buffet breakfast and has a pool outside. I recommend this hotel for those who are budget conscious like me. Will definitely come back here ",3,February 2015
"the place was near the beach as in totally in front of the beach. Easy access to other places where you want to buy food. Breakfast was fully loaded, eat all you can . I was so full that i can no longer swim. If you have children it a place to stay since there's a kids pool where you can let your child stay. The rooms were big and are food for big families.",4,March 2014
"La Carmella is not very welcoming, the first signs I read where about penalty prices they will charge you if you mess up their sheets or pillows or towels, although they did manage to squeeze in a welcoming drink, among the hordes of busy people passing through, in a plastic cup from a large water cooler. The unwelcoming signs followed us to the breakfast table where they again warn you about fines if you don't eat all your food. While I don't condone the wasting of food, at this point I was wondering whether I was actually on holiday in a hotel in a beautiful tropical island or was I some how transported back in time to a nazi camp in auzwich. The breakfast by the way is a disgusting trough of cold cheap food that's supposed to be hot, with queues elbowing each other for a…",2,February 2015
"It was a all boys trip to Boracay Island. La Carmella is clean, well maintained, walking distance to the beach, in house restaurant with breakfast and friendly staff.  What else can you ask for!  Walk around, bargain for water activities and in what ever you buy there. People are friendly and food is awesome.",4,February 2015
"I honestly had high expectations at this hotel because it is being endorsed by celebrities and the pictures posted online look really nice; however I was kinda disappointed when I got here.   1) It took awhile before we got to our room --not sure if it was because we had to check out a few other rooms because the room they were giving us have 2 separate beds.  2) It was an average room. I dont remember if the floor was even tiled.  3) The bathroom has no rugs and the shower has no door --we had to use used towels for the floor. 4) AC is not good, I think I got sick because of it for the reason that it actually blows cold air and it is hard to get it to its right temperature.  5) Bed sheet and towels dont look new to me. It's like they have been used several times. You can see by…",3,January 2015
"Average hotel at Boracay, rooms are clean but there were few things should be noted, safety deposit box not working and the ACU was noisy.  Food-- Don't know what to say all I can say is its not their forte, but still the selection and combination should be improved.  Service wise average but greeting the guests should be a habit of employees and should be learned by the OJTs. We stayed 2 nights, whenever we go in and out we have seen employees and OJTs that just looked at us (no smile, no greetings). Though there were 2 or 3 employees smiling at every guests but not everyone.",3,February 2015
